<?xml version="1.0"?>
<!DOCTYPE softwarelist SYSTEM "softwarelist.dtd">
<!--
license:CC0-1.0
-->
<softwarelist name="pet_quik" description="Commodore PET quickload">

	<!-- https://www.youtube.com/watch?v=OBEfKMFq8lo -->
	<software name="npa">
		<description>No Pets Allowed</description>
		<year>2010</year>
		<publisher>Orb</publisher>
		<!-- cbm4032 only -->

		<part name="quik" interface="cbm_quik">
			<dataarea name="quik" size="31382">
				<rom name="npa.prg" size="31382" crc="55295e40" sha1="43fb301f7f22878773ef9692ea7763191c085244"/>
			</dataarea>
		</part>
	</software>

	<!-- https://www.youtube.com/watch?v=gYHYplCyrM0 -->
	<software name="hardcore">
		<description>Hardcore Petting</description>
		<year>2010</year>
		<publisher>Noice</publisher>
		<!-- 8K RAM -->

		<part name="quik" interface="cbm_quik">
			<dataarea name="quik" size="6013">
				<rom name="hardcore_petting.prg" size="6013" crc="4f2853cf" sha1="c1e4f0d959c69c08c7ea4ea428736bc3ea0a2176"/>
			</dataarea>
		</part>
	</software>

</softwarelist>
