<?xml version="1.0"?>
<!DOCTYPE softwarelist SYSTEM "softwarelist.dtd">
<!--
license:CC0-1.0
-->
<softwarelist name="cbm8096_flop" description="Commodore 8096 diskettes">

	<software name="los96">
		<description>LOS-96</description>
		<year>1981</year>
		<publisher>Commodore</publisher>

		<part name="flop1" interface="floppy_5_25">
			<dataarea name="flop" size="174848">
				<rom name="los96disk.d64" size="174848" crc="b78332c5" sha1="744509449b09fae636f47ac47e6496672c2f7ff0" status="baddump" />
			</dataarea>
		</part>
	</software>

	<software name="geckos">
		<description>GeckOS/A65 (v2.0)</description>
		<year>1999</year>
		<publisher>André Fachat</publisher>
		<sharedfeat name="compatibility" value="NTSC,PAL"/>

		<part name="flop1" interface="floppy_5_25">
			<dataarea name="flop" size="174848">
				<rom name="cbm8x96.d64" size="174848" crc="33210394" sha1="ab59246300847b9ccb00b10f220253bae20e76b2"/>
			</dataarea>
		</part>
	</software>

</softwarelist>
