<?xml version="1.0"?>
<!DOCTYPE softwarelist SYSTEM "softwarelist.dtd">
<!--
license:CC0-1.0
-->
<softwarelist name="ekara_us" description="Takara e-kara (US) cartridges">
	<!-- cartridges contain the ROM only, the XaviX CPU and BIOS are in the base unit -->

	<!-- US cartridges -->

	<!-- e-kara US 5-Songs Starter (US-M001)
	1. "Stronger"                  Britney Spears
	2. "Bye Bye Bye"               *N Sync
	3. "Independent Woman Part 1"  Destiny's Child
	4. "I Want It That Way"        Backstreet Boys
	5. "Yellow Submarine"          The Beatles
	-->
	<software name="us_strt">
		<description>e-kara US 5-Songs Starter (US-M001)</description>
		<year>2000</year>
		<publisher>Takara</publisher>
		<part name="cart" interface="ekara_cart">
			<dataarea name="rom" size="0x080000">
				<rom name="us-m001.u1" size="0x080000" crc="8c12c0c2" sha1="8cc1b098894af25a4bfccada884125b66f5fe8b2"/>
			</dataarea>
		</part>
	</software>

	<!-- e-kara US Volume 1 (US-E001)
	1.  "Oops!...I Did It Again"       Britney Spears
	2.  "...Baby One More Time"        Britney Spears
	3.  "Bye Bye Bye"                  *N Sync
	4.  "It's Gonna Be Me"             *N Sync
	5.  "Take On Me"                   a1
	6.  "Aaron's Party (Come Get It)"  Aaron Carter
	7.  "If Only"                      Hanson
	8.  "He Loves U Not"               Dream
	9.  "The First Night"              Monica
	10. "I Need You"                   LeAnn Rimes
	-->
	<software name="us_vol1">
		<description>e-kara US Volume 1 (US-E001)</description>
		<year>2001</year> <!-- 2000 shown on screen, 2001 on cart -->
		<publisher>Takara</publisher>
		<part name="cart" interface="ekara_cart">
			<dataarea name="rom" size="0x100000">
				<rom name="us-e001.u1" size="0x100000" crc="29df4aea" sha1="b95835aaf8630b61b47e5da0968cd4a1dd3bc517"/>
			</dataarea>
		</part>
	</software>

	<!-- e-kara US Volume 2 (US-E002)
	1.  "Larger Than Life"          Backstreet Boys
	2.  "I'll Be There For You"     Backstreet Boys
	3.  "My Everything"             98 Degrees
	4.  "Dizzy"                     98 Degrees
	5.  "Independent Woman Part 1"  Destiny's Child
	6.  "Waiting For Tonight"       Jennifer Lopez
	7.  "Let Me Let Go"             Faith Hill
	8.  "There's Your Trouble"      Dixie Chicks
	9.  "5678"                      Steps
	10. "Stomp"                     Steps
	-->
	<software name="us_vol2">
		<description>e-kara US Volume 2 (US-E002)</description>
		<year>2001</year> <!-- 2000 shown on screen, 2001 on cart -->
		<publisher>Takara</publisher>
		<part name="cart" interface="ekara_cart">
			<dataarea name="rom" size="0x100000">
				<rom name="us-e002.u1" size="0x100000" crc="6c66772e" sha1="e1e719df1e51caaafd9b3af187059334f7abbba3"/>
			</dataarea>
		</part>
	</software>

	<!-- e-kara US Volume 3 (US-E003)
	1.  "Doesn't Really Matter (radio edit)"   Janet Jackson
	2.  "Saving All My Love For You"           Whitney Houston
	3.  "Water Runs Dry"                       Boys II Men
	4.  "I Want It That Way"                   Backstreet Boys
	5.  "Back To Your Heart"                   Backstreet Boys
	6.  "I Just Called To Say I Love You"      Stevie Wonder
	7.  "We're All Alone"                      Boz Scaggs
	8.  "Crazy For You"                        Madonna
	9.  "True Colors"                          Cyndi Lauper
	10. "Lovin' You"                           Minnie Riperton
	-->
	<software name="us_vol3">
		<description>e-kara US Volume 3 (US-E003)</description>
		<year>2001</year> <!-- 2000 shown on screen, 2001 on cart -->
		<publisher>Takara</publisher>
		<part name="cart" interface="ekara_cart">
			<dataarea name="rom" size="0x100000">
				<rom name="us-e003.u1" size="0x100000" crc="d90a7e58" sha1="37b899676935fb3dda266dc5614ef53cb2c33980"/>
			</dataarea>
		</part>
	</software>

	<!-- e-kara US Volume 4 (US-E004)
	1.  "Can't Buy Me Love"   The Beatles
	2.  "A Hard Day's Night"  The Beatles
	3.  "Ticket To Ride"      The Beatles
	4.  "Yesterday"           The Beatles
	5.  "Help"                The Beatles
	6.  "Michelle"            The Beatles
	7.  "Yellow Submarine"    The Beatles
	8.  "All My Loving"       The Beatles
	9.  "Drive My Car"        The Beatles
	10. "We Can Work It Out"  The Beatles
	-->
	<software name="us_vol4">
		<description>e-kara US Volume 4 (US-E004)</description>
		<year>2001</year> <!-- 2000 shown on screen, 2001 on cart -->
		<publisher>Takara</publisher>
		<part name="cart" interface="ekara_cart">
			<dataarea name="rom" size="0x100000">
				<rom name="us-e004.u1" size="0x100000" crc="790822e9" sha1="cc5806fdc79f777a42980d6825c92837b07fd80d"/>
			</dataarea>
		</part>
	</software>

	<!-- e-kara US Volume 5 (US-E005)
	1.  "Lucy In the Sky With Diamonds"  The Beatles
	2.  "All You Need Is Love"           The Beatles
	3.  "Hello Goodbye"                  The Beatles
	4.  "Hey Jude"                       The Beatles
	5.  "Ob-La-Di, Ob-La-Da"             The Beatles
	6.  "Get Back"                       The Beatles
	7.  "Come Together"                  The Beatles
	8.  "Oh! Darling"                    The Beatles
	9.  "Let It Be"                      The Beatles
	10. "The Long And Winding Road"      The Beatles
	-->
	<software name="us_vol5">
		<description>e-kara US Volume 5 (US-E005)</description>
		<year>2001</year> <!-- 2000 shown on screen, 2001 on cart -->
		<publisher>Takara</publisher>
		<part name="cart" interface="ekara_cart">
			<dataarea name="rom" size="0x100000">
				<rom name="us-e005.u1" size="0x100000" crc="edf1e4ce" sha1="7e5e3116f62897ae023c84842036f24b19c926cc"/>
			</dataarea>
		</part>
	</software>

	<!-- e-kara US Volume 6 (US-E006)
	1.  "Survivor (Album Version)"             Destiny's Child
	2.  "Jumpin', Jumpin'"                     Destiny's Child
	3.  "I Turn To You"                        Christina Aguilera
	4.  "As Long As You're Loving Me"          Vitamin C
	5.  "Body II Body"                         Samantha Mumba
	6.  "Love Don't Cost a Thing"              Jennifer Lopez
	7.  "Again"                                Janet Jackson
	8.  "If I Fall You're Going Down With Me"  Dixie Chicks
	9.  "Can't Fight The Moonlight"            LeAnn Rimes
	10. "American Pie (Album Version)"         Madonna
	-->
	<software name="us_vol6">
		<description>e-kara US Volume 6 (US-E006)</description>
		<year>2001</year> <!-- 2000 shown on screen, 2001 on cart -->
		<publisher>Takara</publisher>
		<part name="cart" interface="ekara_cart">
			<dataarea name="rom" size="0x100000">
				<rom name="us-e006.u1" size="0x100000" crc="e9aaca2f" sha1="983086f068ee38b970c01d2304e757148474aee3"/>
			</dataarea>
		</part>
	</software>

	<!-- e-kara US Volume 7 (US-E007)
	1.  "Show Me The Meaning of Being Lonely"  Backstreet Boys
	2.  "Lucky"                                Britney Spears
	3.  "When It's Over"                       Sugar Ray
	4.  "Bootylicious"                         Destiny's Child
	5.  "Nobody Wants to be Lonely"            Ricky Martin & Christina Aguilera
	6.  "Breathe"                              Faith Hill
	7.  "It's Gonna Be Me"                     *N Sync
	8.  "Don't Think I'm Not"                  Kandi
	9.  "Lady Marmalade"                       Christina Aguilera, Lik'Kim, Mya & Pink
	10. "God Bless The U.S.A."                 Lee Greenwood
	-->
	<software name="us_vol7">
		<description>e-kara US Volume 7 (US-E007)</description>
		<year>2002</year> <!-- 2002 shown on screen, 2001 on cart -->
		<publisher>Takara</publisher>
		<part name="cart" interface="ekara_cart">
			<dataarea name="rom" size="0x100000">
				<rom name="us-e007.u1" size="0x100000" crc="b7f5ca53" sha1="84af6d96512de96dbab03c236b3416b2e604f753"/>
			</dataarea>
		</part>
	</software>

	<!-- e-kara US Volume 8 'No Boys Allowed' (US-E008)
	1.  "I'm A Slave 4 U"           Britney Spears
	2.  "Stronger"                  Britney Spears
	3.  "Oops!...I Did It Again"    Britney Spears
	4.  "Breathe"                   Faith Hill
	5.  "Thank You"                 Dido
	6.  "He Loves U Not"            Dream
	7.  "Believe"                   Cher
	8.  "Case Of The Ex"            Mya
	9.  "Crush"                     Jennifer Paige
	10. "Back and Forth"            Aaliyah
	-->
	<software name="us_vol8">
		<description>e-kara US Volume 8 'No Boys Allowed' (US-E008)</description>
		<year>2002</year> <!-- 2002 shown on screen, 2001 on cart -->
		<publisher>Takara</publisher>
		<part name="cart" interface="ekara_cart">
			<dataarea name="rom" size="0x100000">
				<rom name="us-e008.u1" size="0x100000" crc="5cddaf1f" sha1="345ae679974ae5ae9b506b32323ada234c01f984"/>
			</dataarea>
		</part>
	</software>

	<!-- e-kara US Volume 9 'No Boys Allowed' (US-E009)
	1.  "So In Love With Two"        Mikaila
	2.  "Lady Marmalade"             Christina Aguilera, Lik'Kim, Mya & Pink
	3.  "Genie In A Bottle"          Christina Aguilera
	4.  "Bootylicious"               Destiny's Child
	5.  "Can't Fight The Moonlight"  LeAnn Rimes
	6.  "You Can't Hurry Love"       Dixie Chicks
	7.  "Hot Stuff"                  Donna Summer
	8.  "Crazy For You"              Madonna
	9.  "Someone To Call My Lover"   Janet Jackson
	10.  "All For You"               Janet Jackson
	-->
	<software name="us_vol9">
		<description>e-kara US Volume 9 'No Boys Allowed' (US-E009)</description>
		<year>2002</year> <!-- 2002 shown on screen, 2001 on cart -->
		<publisher>Takara</publisher>
		<part name="cart" interface="ekara_cart">
			<dataarea name="rom" size="0x100000">
				<rom name="us-e009.u1" size="0x100000" crc="0d9c402b" sha1="95652eb71dab74fbf05f8450f2a9b664b455deeb"/>
			</dataarea>
		</part>
	</software>

</softwarelist>
