<?xml version="1.0"?>
<!DOCTYPE softwarelist SYSTEM "softwarelist.dtd">
<!--
license:CC0-1.0
-->
<softwarelist name="sv8000" description="Bandai Super Vision 8000 cartridges">

	<!-- 1 - MISSILEVADER -->
	<software name="misvader">
		<description>Missilevader</description>
		<year>1979</year>
		<publisher>Bandai</publisher>
		<info name="alt_title" value="ミサイルベーダー" />
		<part name="cart" interface="sv8000_cart">
			<dataarea name="rom" size="0x1000">
				<rom name="missilevader.bin" size="0x1000" crc="a634a472" sha1="ac4d4a6adae0c7bf19b3c70e70d6541e0814ab34" />
			</dataarea>
		</part>
	</software>

	<!-- 2 - SPACEFIRE -->
	<software name="spfire">
		<description>Space Fire</description>
		<year>1980</year>
		<publisher>Bandai</publisher>
		<info name="alt_title" value="スペースファイヤー" />
		<part name="cart" interface="sv8000_cart">
			<dataarea name="rom" size="0x1000">
				<rom name="spacefire.bin" size="0x1000" crc="85ce4a88" sha1="3bd00bd4978bc1d27a8e31da00f3f24bcb4f76fd" />
			</dataarea>
		</part>
	</software>

	<!-- 3 - OTHELLO -->
	<software name="othello">
		<description>Othello</description>
		<year>1980</year>
		<publisher>Bandai</publisher>
		<info name="alt_title" value="オセロ" />
		<part name="cart" interface="sv8000_cart">
			<dataarea name="rom" size="0x1000">
				<rom name="othello.bin" size="0x1000" crc="fb3c070e" sha1="9df64c78d32f5d31caea936877f47f8d1cdf538b" />
			</dataarea>
		</part>
	</software>

	<!-- 4 - GUNPROFESSIONAL -->
	<software name="gunprof">
		<description>Gun Fighter</description>
		<year>1980</year>
		<publisher>Bandai</publisher>
		<info name="alt_title" value="ガンプロフェッショナル" />
		<part name="cart" interface="sv8000_cart">
			<dataarea name="rom" size="0x1000">
				<rom name="gunprofessional.bin" size="0x1000" crc="05db65c0" sha1="09dd817ba35103507d50d44583ddcbb74e463dc8" />
			</dataarea>
		</part>
	</software>

	<!-- 5 - PACPACBIRD -->
	<software name="pacpac">
		<description>Pac Pac Bird</description>
		<year>1980</year>
		<publisher>Bandai</publisher>
		<info name="alt_title" value="パクパクバード" />
		<part name="cart" interface="sv8000_cart">
			<dataarea name="rom" size="0x1000">
				<rom name="pacpacbird.bin" size="0x1000" crc="b550e119" sha1="57923a51f8d52f341fe4bec0401189058875fc69" />
			</dataarea>
		</part>
	</software>

	<!-- 6 - SUBMARINE -->
	<software name="submar">
		<description>Submarine</description>
		<year>1980</year>
		<publisher>Bandai</publisher>
		<info name="alt_title" value="サブマリン" />
		<part name="cart" interface="sv8000_cart">
			<dataarea name="rom" size="0x1000">
				<rom name="submarine.bin" size="0x1000" crc="b7d67a05" sha1="1f4929c019608342363bc6337650cc8e763c4430" />
			</dataarea>
		</part>
	</software>

	<!-- 7 - BEAMGALAXIAN -->
	<software name="beamgala">
		<description>Beamgalaxian</description>
		<year>1980</year>
		<publisher>Bandai</publisher>
		<info name="alt_title" value="ビームギャラクシアン" />
		<part name="cart" interface="sv8000_cart">
			<dataarea name="rom" size="0x1000">
				<rom name="beamgalaxian.bin" size="0x1000" crc="009f9567" sha1="78b0d57e83f0a428befac57d5c0869eeefc35953" />
			</dataarea>
		</part>
	</software>

</softwarelist>
